{
  "$schema": "https://json-schema.org/draft/2020-12/schema",
  "type": "object",
  "required": ["relevant", "score", "reason", "fulltext_required"],
  "properties": {
    "relevant": {"type": "boolean"},
    "score": {"type": "number", "minimum": 0, "maximum": 100},
    "reason": {"type": "string", "minLength": 1},
    "reject_reason": {"type": ["string", "null"]},
    "fulltext_required": {"type": "boolean"},
    "matched_signals": {"type": "array", "items": {"type": "string"}, "maxItems": 8}
  },
  "additionalProperties": false
}
