{"relevant": false, "score": 87, "reason": "Cross-datacenter serving architecture with bandwidth-aware scheduling and cache-aware request placement that transfers KV cache over commodity Ethernet to decode clusters.", "reject_reason": "Pruned: below per-topic cap for fact-extraction budget", "fulltext_required": false, "matched_signals": ["KV cache transfer", "bandwidth-aware scheduling", "cache-aware placement", "cross-datacenter", "commodity Ethernet", "prefill offloading"]}