{"relevant":false,"score":25,"reason":"Attribution framework identifying which AI coding agent authored a PR from behavioral fingerprints; about identification/governance, not acceleration.","reject_reason":"Off-topic: AI agent attribution/identification from PR fingerprints, no acceleration or context-retrieval mechanism.","fulltext_required":false,"matched_signals":[]}
