{
  "relevant": true,
  "score": 74,
  "reason": "SemiAnalysis对Kimi K3架构的解析:压缩记忆(compressed memory)、跨深度注意力、潜在专家路由及推理性能,涉及记忆压缩与推理效率的具体架构机制,与AI Infra/内存/KVCache方向直接相关;summary简略需读全文确认推理基准数据。",
  "reject_reason": null,
  "fulltext_required": true,
  "matched_signals": ["Kimi K3", "compressed memory", "latent expert routing", "attention across depth", "inference performance"]
}
