{"relevant":false,"score":45,"reason":"Generic vLLM release notes spanning hundreds of unrelated features; PD-disaggregation and KV-tiering network items are a small fraction of the changelog.","reject_reason":"General LLM-serving release with no focused network/token-aware mechanism; TPN-relevant items are minor sub-items amid model/quantization/kernel changes.","fulltext_required":false,"matched_signals":["PD disaggregation","NIXL","KV offloading","DCP"]}