{"relevant": false, "score": 75, "reason": "GTC 2026 session on using DOCA for Storage with BlueField DPU storage offload including BlueField-4 context memory storage to accelerate AI inference.", "reject_reason": "Pruned: below per-topic cap for fact-extraction budget", "fulltext_required": false, "matched_signals": ["DOCA for Storage", "BlueField-4", "storage offload", "AI inference", "context memory"]}