{"relevant":false,"score":55,"reason":"MoE expert routing on direct-connect topologies via token-aware multicast trees; targets MoE collective traffic, not inference-serving TTFT/TPOT or KV cache / PD disaggregation networks.","reject_reason":"Domain is MoE all-to-all/collective communication optimization, not inference token-performance networks; no KV-cache, prefill-decode, or TTFT/TPOT angle.","fulltext_required":false,"matched_signals":["token-aware multicast","MoE routing","direct-connect topology","bandwidth"]}