{
  "relevant": false,
  "score": 28,
  "reason": "MemCollusion collusive memory-poisoning attack on agent persistent memory; security threat/red-team, not compute/serving/network infra.",
  "reject_reason": "Off-topic: agent memory-poisoning security attack; outside AI-infra/serving/network/memory scope.",
  "fulltext_required": false,
  "matched_signals": []
}